<?xml version="1.0" encoding="UTF-8"?>
<dataroot xmlns:od="urn:schemas-microsoft-com:officedata" xmlns:xsi="http://www.w3.org/2001/XMLSchema-instance"  xsi:noNamespaceSchemaLocation="AnimeTable.xsd" generated="2021-01-26T23:06:44">
<AnimeTable>
<WatchOrder>262</WatchOrder>
<AnimeName>Cowboy Bebop</AnimeName>
<Completed>0</Completed>
<Dropped>0</Dropped>
</AnimeTable>
<AnimeTable>
<WatchOrder>263</WatchOrder>
<AnimeName>Crono Crusasde</AnimeName>
<Completed>0</Completed>
<Dropped>0</Dropped>
</AnimeTable>
<AnimeTable>
<WatchOrder>264</WatchOrder>
<AnimeName>Jujutsu Kaisen</AnimeName>
<Completed>0</Completed>
<Dropped>0</Dropped>
</AnimeTable>
<AnimeTable>
<WatchOrder>265</WatchOrder>
<AnimeName>Standing on 1M lives</AnimeName>
<Completed>0</Completed>
<Dropped>0</Dropped>
</AnimeTable>
<AnimeTable>
<WatchOrder>266</WatchOrder>
<AnimeName>King&apos;s Raid</AnimeName>
<Completed>0</Completed>
<Dropped>0</Dropped>
</AnimeTable>
<AnimeTable>
<WatchOrder>267</WatchOrder>
<AnimeName>Shinkekai Yori</AnimeName>
<Completed>0</Completed>
<Dropped>0</Dropped>
</AnimeTable>
<AnimeTable>
<WatchOrder>268</WatchOrder>
<AnimeName>Shimoneta</AnimeName>
<Ratings>7.2</Ratings>
<Completed>1</Completed>
<Dropped>0</Dropped>
<Episode_x0020_Watched>12</Episode_x0020_Watched>
</AnimeTable>
<AnimeTable>
<WatchOrder>269</WatchOrder>
<AnimeName>Our Last Crusade</AnimeName>
<Total_x0020_Episodes>12</Total_x0020_Episodes>
<Completed>0</Completed>
<Dropped>0</Dropped>
</AnimeTable>
<AnimeTable>
<WatchOrder>270</WatchOrder>
<AnimeName>The Money &amp; Soul of Prossibility</AnimeName>
<Ratings>7.12</Ratings>
<Total_x0020_Episodes>11</Total_x0020_Episodes>
<Completed>1</Completed>
<Dropped>0</Dropped>
<Episode_x0020_Watched>13</Episode_x0020_Watched>
</AnimeTable>
<AnimeTable>
<WatchOrder>271</WatchOrder>
<AnimeName>Kiznaiver</AnimeName>
<Completed>1</Completed>
<Dropped>0</Dropped>
<Episode_x0020_Watched>13</Episode_x0020_Watched>
</AnimeTable>
<AnimeTable>
<WatchOrder>272</WatchOrder>
<AnimeName>Tales of Zesteria the X</AnimeName>
<Completed>0</Completed>
<Dropped>0</Dropped>
<Remarks>opening../</Remarks>
</AnimeTable>
<AnimeTable>
<WatchOrder>273</WatchOrder>
<AnimeName>Aldnoah Zero</AnimeName>
<Completed>0</Completed>
<Dropped>0</Dropped>
</AnimeTable>
<AnimeTable>
<WatchOrder>274</WatchOrder>
<AnimeName>Blood Lad</AnimeName>
<Ratings>7.1</Ratings>
<Total_x0020_Episodes>10</Total_x0020_Episodes>
<Completed>1</Completed>
<Dropped>0</Dropped>
<Remarks>donâ€™t be fooled by crappy cover</Remarks>
</AnimeTable>
<AnimeTable>
<WatchOrder>275</WatchOrder>
<AnimeName>Akudama Drive</AnimeName>
<Completed>0</Completed>
<Dropped>0</Dropped>
</AnimeTable>
<AnimeTable>
<WatchOrder>276</WatchOrder>
<AnimeName>Dorohedoro</AnimeName>
<Completed>0</Completed>
<Dropped>0</Dropped>
</AnimeTable>
<AnimeTable>
<WatchOrder>277</WatchOrder>
<AnimeName>Tonikawa Kawai</AnimeName>
<Completed>0</Completed>
<Dropped>0</Dropped>
</AnimeTable>
<AnimeTable>
<WatchOrder>278</WatchOrder>
<AnimeName>Talentless Nana</AnimeName>
<Ratings>8.25</Ratings>
<Completed>1</Completed>
<Dropped>0</Dropped>
<Episode_x0020_Watched>13</Episode_x0020_Watched>
</AnimeTable>
<AnimeTable>
<WatchOrder>279</WatchOrder>
<AnimeName>Heaven Official&apos;s Blessing</AnimeName>
<Ratings>7.85</Ratings>
<Completed>1</Completed>
<Dropped>0</Dropped>
<Episode_x0020_Watched>11</Episode_x0020_Watched>
</AnimeTable>
<AnimeTable>
<WatchOrder>280</WatchOrder>
<AnimeName>Grand Blue</AnimeName>
<Ratings>8.02</Ratings>
<Completed>1</Completed>
<Dropped>0</Dropped>
</AnimeTable>
<AnimeTable>
<WatchOrder>281</WatchOrder>
<AnimeName>Welcome To Demon School</AnimeName>
<Completed>1</Completed>
<Dropped>0</Dropped>
</AnimeTable>
<AnimeTable>
<WatchOrder>282</WatchOrder>
<AnimeName>Golden Boy</AnimeName>
<Ratings>7.56</Ratings>
<Completed>1</Completed>
<Dropped>0</Dropped>
<Episode_x0020_Watched>5</Episode_x0020_Watched>
</AnimeTable>
<AnimeTable>
<WatchOrder>283</WatchOrder>
<AnimeName>Nagi No Asu Kara</AnimeName>
<Ratings>8.65</Ratings>
<Completed>0</Completed>
<Dropped>0</Dropped>
</AnimeTable>
<AnimeTable>
<WatchOrder>284</WatchOrder>
<AnimeName>Drifters</AnimeName>
<Completed>0</Completed>
<Dropped>0</Dropped>
</AnimeTable>
<AnimeTable>
<WatchOrder>285</WatchOrder>
<AnimeName>By the Grace of Gods</AnimeName>
<Ratings>7.65</Ratings>
<Completed>1</Completed>
<Dropped>0</Dropped>
</AnimeTable>
<AnimeTable>
<WatchOrder>286</WatchOrder>
<AnimeName>Berserk</AnimeName>
<Ratings>8.65</Ratings>
<Completed>1</Completed>
<Dropped>0</Dropped>
</AnimeTable>
<AnimeTable>
<WatchOrder>287</WatchOrder>
<AnimeName>Moriarty The Patriot</AnimeName>
<Completed>0</Completed>
<Dropped>0</Dropped>
</AnimeTable>
<AnimeTable>
<WatchOrder>288</WatchOrder>
<AnimeName>One Outs</AnimeName>
<Ratings>8.65</Ratings>
<Completed>1</Completed>
<Dropped>0</Dropped>
</AnimeTable>
<AnimeTable>
<WatchOrder>289</WatchOrder>
<AnimeName>Jossless Reincarnation</AnimeName>
<Ratings>8</Ratings>
<Completed>0</Completed>
<Dropped>0</Dropped>
</AnimeTable>
<AnimeTable>
<WatchOrder>290</WatchOrder>
<AnimeName>Welcome To N.H.K</AnimeName>
<Ratings>7.65</Ratings>
<Completed>1</Completed>
<Dropped>0</Dropped>
<Episode_x0020_Watched>25</Episode_x0020_Watched>
</AnimeTable>
<AnimeTable>
<WatchOrder>291</WatchOrder>
<AnimeName>Dusk Maiden of Anmesia</AnimeName>
<Ratings>8.35</Ratings>
<Completed>1</Completed>
<Dropped>0</Dropped>
<Episode_x0020_Watched>13</Episode_x0020_Watched>
</AnimeTable>
<AnimeTable>
<WatchOrder>292</WatchOrder>
<AnimeName>Trigun</AnimeName>
<Ratings>8.65</Ratings>
<Completed>1</Completed>
<Dropped>0</Dropped>
<Episode_x0020_Watched>26</Episode_x0020_Watched>
</AnimeTable>
<AnimeTable>
<WatchOrder>293</WatchOrder>
<Completed>0</Completed>
<Dropped>0</Dropped>
</AnimeTable>
<AnimeTable>
<WatchOrder>294</WatchOrder>
<Completed>0</Completed>
<Dropped>0</Dropped>
</AnimeTable>
<AnimeTable>
<WatchOrder>295</WatchOrder>
<Completed>0</Completed>
<Dropped>0</Dropped>
</AnimeTable>
<AnimeTable>
<WatchOrder>296</WatchOrder>
<Completed>0</Completed>
<Dropped>0</Dropped>
</AnimeTable>
<AnimeTable>
<WatchOrder>297</WatchOrder>
<Completed>0</Completed>
<Dropped>0</Dropped>
</AnimeTable>
<AnimeTable>
<WatchOrder>298</WatchOrder>
<Completed>0</Completed>
<Dropped>0</Dropped>
</AnimeTable>
<AnimeTable>
<WatchOrder>299</WatchOrder>
<Completed>0</Completed>
<Dropped>0</Dropped>
</AnimeTable>
<AnimeTable>
<WatchOrder>300</WatchOrder>
<Completed>0</Completed>
<Dropped>0</Dropped>
</AnimeTable>
<AnimeTable>
<WatchOrder>2</WatchOrder>
<AnimeName>DB Series</AnimeName>
<Ratings>9.6</Ratings>
<Completed>1</Completed>
<Dropped>0</Dropped>
</AnimeTable>
<AnimeTable>
<WatchOrder>3</WatchOrder>
<AnimeName>Death Note</AnimeName>
<Ratings>9.25</Ratings>
<Completed>1</Completed>
<Dropped>0</Dropped>
</AnimeTable>
<AnimeTable>
<WatchOrder>4</WatchOrder>
<AnimeName>Code Geass</AnimeName>
<Ratings>9.5</Ratings>
<Completed>1</Completed>
<Dropped>0</Dropped>
</AnimeTable>
<AnimeTable>
<WatchOrder>5</WatchOrder>
<AnimeName>Hunter X Hunter</AnimeName>
<Ratings>8.39</Ratings>
<Completed>1</Completed>
<Dropped>0</Dropped>
</AnimeTable>
<AnimeTable>
<WatchOrder>6</WatchOrder>
<AnimeName>HighSchool DxD</AnimeName>
<Ratings>9.29</Ratings>
<Completed>1</Completed>
<Dropped>0</Dropped>
</AnimeTable>
<AnimeTable>
<WatchOrder>7</WatchOrder>
<AnimeName>Charlotee</AnimeName>
<Ratings>7.53</Ratings>
<Total_x0020_Episodes>12</Total_x0020_Episodes>
<Completed>1</Completed>
<Dropped>0</Dropped>
</AnimeTable>
<AnimeTable>
<WatchOrder>8</WatchOrder>
<AnimeName>Akame Ga Kill</AnimeName>
<Ratings>8.75</Ratings>
<Completed>1</Completed>
<Dropped>0</Dropped>
</AnimeTable>
<AnimeTable>
<WatchOrder>9</WatchOrder>
<AnimeName>Prison School</AnimeName>
<Ratings>3.1</Ratings>
<Completed>1</Completed>
<Dropped>1</Dropped>
</AnimeTable>
<AnimeTable>
<WatchOrder>10</WatchOrder>
<AnimeName>Familer of Zero</AnimeName>
<Ratings>6.15</Ratings>
<Completed>0</Completed>
<Dropped>1</Dropped>
</AnimeTable>
<AnimeTable>
<WatchOrder>11</WatchOrder>
<AnimeName>Monster Musume</AnimeName>
<Ratings>5.6</Ratings>
<Total_x0020_Episodes>12</Total_x0020_Episodes>
<Completed>0</Completed>
<Dropped>1</Dropped>
</AnimeTable>
<AnimeTable>
<WatchOrder>12</WatchOrder>
<AnimeName>Masau Gakun HXH</AnimeName>
<Ratings>7.15</Ratings>
<Total_x0020_Episodes>12</Total_x0020_Episodes>
<Completed>1</Completed>
<Dropped>0</Dropped>
</AnimeTable>
<AnimeTable>
<WatchOrder>13</WatchOrder>
<AnimeName>SAO</AnimeName>
<Ratings>8.95</Ratings>
<Completed>1</Completed>
<Dropped>0</Dropped>
</AnimeTable>
<AnimeTable>
<WatchOrder>14</WatchOrder>
<AnimeName>Hajiimeto no Gal</AnimeName>
<Ratings>6.2</Ratings>
<Total_x0020_Episodes>12</Total_x0020_Episodes>
<Completed>1</Completed>
<Dropped>0</Dropped>
</AnimeTable>
<AnimeTable>
<WatchOrder>15</WatchOrder>
<AnimeName>Shimmai Maou no Testament</AnimeName>
<Ratings>8.50</Ratings>
<Completed>1</Completed>
<Dropped>0</Dropped>
</AnimeTable>
<AnimeTable>
<WatchOrder>16</WatchOrder>
<AnimeName>Trinity Seven</AnimeName>
<Ratings>7.77</Ratings>
<Completed>1</Completed>
<Dropped>0</Dropped>
</AnimeTable>
<AnimeTable>
<WatchOrder>17</WatchOrder>
<AnimeName>Highschool of the dead</AnimeName>
<Ratings>6.9</Ratings>
<Completed>1</Completed>
<Dropped>0</Dropped>
</AnimeTable>
<AnimeTable>
<WatchOrder>18</WatchOrder>
<AnimeName>KissXsis</AnimeName>
<Ratings>7.7</Ratings>
<Total_x0020_Episodes>12</Total_x0020_Episodes>
<Completed>1</Completed>
<Dropped>0</Dropped>
</AnimeTable>
<AnimeTable>
<WatchOrder>19</WatchOrder>
<AnimeName>Freezing</AnimeName>
<Ratings>6.21</Ratings>
<Total_x0020_Episodes>12</Total_x0020_Episodes>
<Completed>1</Completed>